{
  "$schema": "https://json-schema.org/draft/2020-12/schema",
  "$id": "https://elabora.studio/schemas/0.1.3/plan.schema.json",
  "title": "Elabora plan (plan.json)",
  "description": "The contract layer: the plan the client validates (objectives, ordered plan items, locked texts, assessment questions, sources). plan.json is always the working copy, written directly by the author and their agent at any time; its versions (V1, V2…: frozen copies made by hand, sent to the client, one of them validated) are in plan-versions/ (D52). Release builds need a validated version.",
  "type": "object",
  "additionalProperties": false,
  "required": [
    "id",
    "title",
    "objectives",
    "items"
  ],
  "properties": {
    "$schema": {
      "type": "string"
    },
    "id": {
      "$ref": "defs.schema.json#/$defs/planId",
      "description": "Plan identifier, for example PLAN-ACME-NET-V3."
    },
    "title": {
      "type": "string",
      "minLength": 1,
      "maxLength": 200
    },
    "businessGoal": {
      "type": "string",
      "maxLength": 1000,
      "description": "Business outcome the course serves (guardrail A4)."
    },
    "audience": {
      "type": "object",
      "additionalProperties": false,
      "properties": {
        "role": {
          "type": "string",
          "maxLength": 200
        },
        "priorKnowledge": {
          "enum": [
            "low",
            "medium",
            "high"
          ]
        },
        "notes": {
          "type": "string",
          "maxLength": 1000
        }
      }
    },
    "duration": {
      "type": "object",
      "additionalProperties": false,
      "minProperties": 1,
      "description": "The learner time the course is meant to take, in minutes, as the author or the client asked for it: a range (min and max, min not above max), one figure (min equal to max), a floor (min alone: longer than that, where an agent proposes several modules) or a ceiling (max alone). course.json durationMinutes is the time of the built course, written into the package.",
      "properties": {
        "min": {
          "type": "integer",
          "minimum": 1,
          "maximum": 600
        },
        "max": {
          "type": "integer",
          "minimum": 1,
          "maximum": 600
        }
      }
    },
    "decided": {
      "type": "array",
      "maxItems": 20,
      "description": "Before the plan is validated: what the agent decided by itself because the author left it open (a 3D scene, the tone, the format), which the author reads first in the app's Plan view and may change. Written in the course language, a few words each. Validating a version of the plan removes it, and it is outside the content hash: no version holds it, it is never part of the contract (D51).",
      "items": {
        "type": "object",
        "additionalProperties": false,
        "required": [
          "topic",
          "choice"
        ],
        "properties": {
          "topic": {
            "$ref": "#/$defs/planTopic",
            "description": "What was decided. The app names these topics as its « Nouveau module » page asks them: audience, duration, language, format, 3d, voices, business-goal, quizzes, case, tone, brand, accessibility, lms. Another topic needs a label."
          },
          "label": {
            "type": "string",
            "minLength": 1,
            "maxLength": 80,
            "description": "The question as the author would ask it, for a topic the app does not name (« Un fil rouge ? »)."
          },
          "choice": {
            "type": "string",
            "minLength": 1,
            "maxLength": 200,
            "description": "What the agent chose (« Oui : le réseau du site, à explorer »)."
          },
          "why": {
            "type": "string",
            "minLength": 1,
            "maxLength": 200,
            "description": "Where it shows or why, in a few words (« partie 3, comme le demande le brief »)."
          },
          "items": {
            "type": "array",
            "uniqueItems": true,
            "items": {
              "$ref": "defs.schema.json#/$defs/planId"
            },
            "description": "The plan items the decision shapes."
          }
        }
      }
    },
    "question": {
      "type": "object",
      "additionalProperties": false,
      "required": [
        "text"
      ],
      "description": "Before the plan is validated: the one question the agent asks the author now, the one whose answer would change the plan most; the next comes once it is answered. The plan is written whole meanwhile. Validating a version of the plan removes it, and it is outside the content hash (D51).",
      "properties": {
        "text": {
          "type": "string",
          "minLength": 1,
          "maxLength": 300,
          "description": "The question, in the course language, that the author can answer in a sentence."
        },
        "topic": {
          "$ref": "#/$defs/planTopic"
        },
        "items": {
          "type": "array",
          "uniqueItems": true,
          "items": {
            "$ref": "defs.schema.json#/$defs/planId"
          },
          "description": "The plan items the answer would change."
        }
      }
    },
    "sources": {
      "description": "Sources of truth provided by the client or experts. Factual claims should cite them (guardrail G1).",
      "type": "array",
      "items": {
        "type": "object",
        "additionalProperties": false,
        "required": [
          "id",
          "title"
        ],
        "properties": {
          "id": {
            "$ref": "defs.schema.json#/$defs/planId"
          },
          "title": {
            "type": "string",
            "minLength": 1,
            "maxLength": 300
          },
          "type": {
            "type": "string",
            "maxLength": 100,
            "description": "For example internal procedure, regulation, expert interview."
          },
          "version": {
            "type": "string",
            "maxLength": 50
          }
        }
      }
    },
    "objectives": {
      "type": "array",
      "minItems": 1,
      "items": {
        "type": "object",
        "additionalProperties": false,
        "required": [
          "id",
          "statement"
        ],
        "properties": {
          "id": {
            "$ref": "defs.schema.json#/$defs/planId"
          },
          "statement": {
            "type": "string",
            "minLength": 1,
            "maxLength": 500,
            "description": "Observable behaviour: action verb, condition, criterion (guardrail A3). Avoid 'understand' or 'know' alone."
          },
          "short": {
            "type": "string",
            "minLength": 1,
            "maxLength": 60,
            "description": "A short name of three to five words (« Les contrefaçons »), shown beside the objective's number wherever the plan refers to it. Optional: without it, the start of the statement."
          },
          "bloom": {
            "enum": [
              "remember",
              "understand",
              "apply",
              "analyze",
              "evaluate",
              "create"
            ]
          },
          "criterion": {
            "type": "string",
            "maxLength": 300,
            "description": "Success criterion, for example 4 out of 5 scenarios solved."
          },
          "sources": {
            "type": "array",
            "items": {
              "$ref": "defs.schema.json#/$defs/planId"
            }
          }
        }
      }
    },
    "items": {
      "description": "Ordered storyboard items. Every item must be covered by at least one screen (guardrail A1), and every screen must cover at least one item.",
      "type": "array",
      "minItems": 1,
      "items": {
        "$ref": "#/$defs/item"
      }
    },
    "spacing": {
      "description": "Planned spaced retrieval after the module (guardrail B5), for example [\"D+2\", \"D+7\", \"D+30\"]. Delivered outside the package (LMS reminders, emails, micro-modules).",
      "type": "array",
      "items": {
        "type": "string",
        "maxLength": 50
      }
    },
    "waivers": {
      "description": "Approved exceptions to pedagogical warnings. They are listed in the proof report.",
      "type": "array",
      "items": {
        "type": "object",
        "additionalProperties": false,
        "required": [
          "code",
          "reason",
          "approvedBy"
        ],
        "properties": {
          "code": {
            "type": "string",
            "pattern": "^[EW]_[A-Z0-9_]+$",
            "description": "Diagnostic code waived."
          },
          "target": {
            "type": "string",
            "maxLength": 64,
            "description": "Optional id the waiver is limited to (screen, block, item)."
          },
          "reason": {
            "type": "string",
            "minLength": 1,
            "maxLength": 500
          },
          "approvedBy": {
            "type": "string",
            "minLength": 1,
            "maxLength": 200
          }
        }
      }
    },
    "translationOf": {
      "type": "object",
      "additionalProperties": false,
      "required": [
        "id",
        "contentHash",
        "language"
      ],
      "description": "Set by elabora translate build: the source plan this one translates (its id, content hash and language). The translated plan needs its own approval (elabora translate approve), which the translated course holds as its validated version.",
      "properties": {
        "id": {
          "type": "string"
        },
        "contentHash": {
          "type": "string"
        },
        "language": {
          "type": "string"
        }
      }
    }
  },
  "$defs": {
    "planTopic": {
      "type": "string",
      "pattern": "^[a-z0-9][a-z0-9-]{0,31}$",
      "description": "A choice the author makes or leaves to the agent: lowercase letters, digits and hyphens."
    },
    "item": {
      "type": "object",
      "additionalProperties": false,
      "required": [
        "id",
        "kind",
        "title",
        "objectives"
      ],
      "properties": {
        "id": {
          "$ref": "defs.schema.json#/$defs/planId"
        },
        "kind": {
          "enum": [
            "intro",
            "exposition",
            "demonstration",
            "practice",
            "scenario",
            "assessment",
            "summary"
          ],
          "description": "Pedagogical function. practice, scenario and assessment items need learner activity (retrieval, decision or production)."
        },
        "title": {
          "type": "string",
          "minLength": 1,
          "maxLength": 200
        },
        "part": {
          "type": "string",
          "minLength": 1,
          "maxLength": 200,
          "description": "The part of the module the item belongs to, by its title (« Le texte du Gai Savoir »): consecutive items with the same part make one part, an item without one continues the part before it, and the course's sections follow them. Optional: a plan without parts takes those of course.json, the sections that hold its items' screens."
        },
        "description": {
          "type": "string",
          "maxLength": 2000,
          "description": "What the validated storyboard says this item contains."
        },
        "voiceover": {
          "type": "array",
          "minItems": 1,
          "maxItems": 60,
          "description": "The voice-over the client validated for this item (a storyboard's voice-over column), line by line: a screen that covers the item takes it as its narration script (elabora narration from-plan, the app's « Reprendre la voix off du plan »).",
          "items": {
            "type": "object",
            "additionalProperties": false,
            "required": ["text"],
            "properties": {
              "speaker": { "$ref": "defs.schema.json#/$defs/slug", "description": "A speaker of course.json speakers (default: the first)." },
              "text": { "type": "string", "minLength": 1, "maxLength": 2000, "description": "Word for word what is said." }
            }
          }
        },
        "objectives": {
          "type": "array",
          "items": {
            "$ref": "defs.schema.json#/$defs/planId"
          },
          "description": "Objectives served. May be empty only for intro and summary items."
        },
        "sources": {
          "type": "array",
          "items": {
            "$ref": "defs.schema.json#/$defs/planId"
          }
        },
        "lockedTexts": {
          "description": "Validated texts. Blocks reuse them with textRef, so the module always shows the plan's wording: rewording one on the canvas writes it here.",
          "type": "array",
          "items": {
            "type": "object",
            "additionalProperties": false,
            "required": [
              "id",
              "text"
            ],
            "properties": {
              "id": {
                "$ref": "defs.schema.json#/$defs/planId"
              },
              "text": {
                "$ref": "defs.schema.json#/$defs/markdown"
              },
              "verbatim": {
                "type": "boolean",
                "description": "The client wants this text as signed, « à l'identique » (a legal notice, a quote): only the author changes it, deliberately; agents' writes that change it are refused, and a change since the validated version is flagged (W_PLAN_VERBATIM_CHANGED)."
              }
            }
          }
        },
        "questions": {
          "description": "Validated questions. Quiz blocks reuse them with questionRef.",
          "type": "array",
          "items": {
            "$ref": "#/$defs/question"
          }
        }
      }
    },
    "question": {
      "type": "object",
      "additionalProperties": false,
      "required": [
        "id",
        "stem",
        "mode"
      ],
      "properties": {
        "id": {
          "$ref": "defs.schema.json#/$defs/planId"
        },
        "stem": {
          "$ref": "defs.schema.json#/$defs/markdown"
        },
        "mode": {
          "enum": [
            "single",
            "multiple",
            "numeric"
          ],
          "description": "single / multiple: choice question with options. numeric: the learner types a number (answer, tolerance, unit, feedback, misconceptions)."
        },
        "objectives": {
          "type": "array",
          "items": {
            "$ref": "defs.schema.json#/$defs/planId"
          }
        },
        "bloom": {
          "enum": [
            "remember",
            "understand",
            "apply",
            "analyze",
            "evaluate",
            "create"
          ]
        },
        "options": {
          "type": "array",
          "minItems": 2,
          "maxItems": 6,
          "items": {
            "type": "object",
            "additionalProperties": false,
            "required": [
              "id",
              "text",
              "correct"
            ],
            "properties": {
              "id": {
                "type": "string",
                "pattern": "^[a-z0-9]{1,8}$"
              },
              "text": {
                "type": "string",
                "minLength": 1,
                "maxLength": 500
              },
              "correct": {
                "type": "boolean"
              },
              "feedback": {
                "$ref": "defs.schema.json#/$defs/markdown",
                "description": "Elaborated feedback: why this option is right or wrong (guardrail D1)."
              }
            }
          }
        },
        "answer": {
          "type": "number"
        },
        "tolerance": {
          "$ref": "defs.schema.json#/$defs/numericTolerance"
        },
        "unit": {
          "type": "string",
          "maxLength": 30
        },
        "feedback": {
          "$ref": "defs.schema.json#/$defs/numericFeedback"
        },
        "misconceptions": {
          "$ref": "defs.schema.json#/$defs/misconceptions"
        }
      },
      "allOf": [
        {
          "if": {
            "properties": {
              "mode": {
                "const": "numeric"
              }
            },
            "required": [
              "mode"
            ]
          },
          "then": {
            "required": [
              "answer",
              "feedback"
            ]
          },
          "else": {
            "required": [
              "options"
            ]
          }
        }
      ]
    }
  }
}
